{
  "schema_version": "skill-contract.v1",
  "skill_id": "code-reviewer",
  "status": "canonical",
  "sources": {
    "skill_md": {
      "primary": "bundled/skills/code-reviewer/SKILL.md",
      "alternates": []
    }
  },
  "frontmatter": {
    "required_keys": [
      "name",
      "description"
    ],
    "invariants": {
      "name_equals_skill_id": true
    }
  },
  "notes": "Batch A canonical contract (conservative): validate YAML frontmatter existence + name/description presence + name == skill_id."
}

